{
  "catalog_version": "1.0.0",
  "generated_at": "2026-08-01T00:00:00Z",
  "scope": "governance_metadata_only",
  "empirical_records_ingested": 0,
  "hpo_release": {
    "tag": "v2026-06-23",
    "commit_sha": "1366616bda33cd5eb18bb232287e139a1b075eb8",
    "published_at": "2026-06-23T12:08:40Z",
    "authority": "Human Phenotype Ontology Consortium",
    "release_url": "https://github.com/obophenotype/human-phenotype-ontology/releases/tag/v2026-06-23",
    "mapping_document_url": "https://github.com/obophenotype/human-phenotype-ontology/blob/v2026-06-23/docs/developers/mappings.md",
    "mapping_document_blob_sha": "cdc83157c54662f661fedadeb53cb0c125f8d306",
    "primary_asset": {
      "name": "hp.json",
      "size_bytes": 23019454,
      "sha256": "3b646565695329aa399e937883c68d5d424d0df5eaab2f22baa0e08d44fdbe87",
      "url": "https://github.com/obophenotype/human-phenotype-ontology/releases/download/v2026-06-23/hp.json"
    },
    "license_status": "custom_hpo_license_maintainer_review_required",
    "license_evidence_url": "https://github.com/obophenotype/human-phenotype-ontology/blob/v2026-06-23/LICENSE.md",
    "payload_commit_allowed": false
  },
  "mappings": [
    {
      "source_id": "hpo-hp-mesh-sssom",
      "mapping_family": "HP-MESH",
      "provider": "Monarch Initiative",
      "originating_authority": "MedGen",
      "authority_role": "derived_aggregator",
      "format": "SSSOM TSV",
      "source_release": "2026-07-19",
      "release_kind": "date_snapshot",
      "versioned_url": "https://data.monarchinitiative.org/mappings/2026-07-19/hp_mesh.sssom.tsv",
      "mutable_alias_url": "https://data.monarchinitiative.org/mappings/latest/hp_mesh.sssom.tsv",
      "integrity": {"algorithm": "sha256", "value": "fd34f2884d08389a757af26537ae76f807b94d55bd3bb703816ff63239888bed"},
      "artifact_size_bytes": 287976,
      "mapping_set_id": "https://w3id.org/sssom/mappings/11cc9c2c-f621-45bd-b9d0-da99af63e090",
      "semantic_role": "crosswalk",
      "origin_dataset": "MedGenIDMappings.txt",
      "derivation_path": ["MedGenIDMappings.txt", "Monarch mapping transformation", "HP-MESH SSSOM snapshot"],
      "shared_lineage_cluster": "medgen-derived-hpo-mappings",
      "independent_evidence_group": "medgen-id-mappings-2026-07-19",
      "license_status": "sssom_license_unspecified_maintainer_review_required",
      "license_evidence_url": "https://data.monarchinitiative.org/mappings/2026-07-19/hp_mesh.sssom.tsv",
      "payload_commit_allowed": false,
      "metadata_commit_allowed": true,
      "active_language_overlap_status": "not_applicable_identifier_mapping",
      "update_cadence": "provider_date_snapshots",
      "expected_reviewer_burden": "medium",
      "status": "metadata_verified_payload_blocked",
      "retrieved_at": "2026-08-01T00:00:00Z",
      "evidence_urls": [
        "https://github.com/obophenotype/human-phenotype-ontology/blob/v2026-06-23/docs/developers/mappings.md",
        "https://data.monarchinitiative.org/mappings/2026-07-19/hp_mesh.sssom.tsv"
      ],
      "members": []
    },
    {
      "source_id": "hpo-hp-umls-sssom",
      "mapping_family": "HP-UMLS",
      "provider": "Monarch Initiative",
      "originating_authority": "MedGen",
      "authority_role": "derived_aggregator",
      "format": "SSSOM TSV",
      "source_release": "2026-07-19",
      "release_kind": "date_snapshot",
      "versioned_url": "https://data.monarchinitiative.org/mappings/2026-07-19/umls_hp.sssom.tsv",
      "mutable_alias_url": "https://data.monarchinitiative.org/mappings/latest/umls_hp.sssom.tsv",
      "integrity": {"algorithm": "sha256", "value": "fd5c1c174ef04fd53a683873379ffadb8cd65a19892b8f26da0867d78729a288"},
      "artifact_size_bytes": 1287905,
      "mapping_set_id": "https://w3id.org/sssom/mappings/467f578f-3319-4fb4-92fb-bddaf41b0c1f",
      "semantic_role": "crosswalk",
      "origin_dataset": "MedGenIDMappings.txt",
      "derivation_path": ["MedGenIDMappings.txt", "Monarch mapping transformation", "HP-UMLS SSSOM snapshot"],
      "shared_lineage_cluster": "medgen-derived-hpo-mappings",
      "independent_evidence_group": "medgen-id-mappings-2026-07-19",
      "license_status": "sssom_license_unspecified_maintainer_review_required",
      "license_evidence_url": "https://data.monarchinitiative.org/mappings/2026-07-19/umls_hp.sssom.tsv",
      "payload_commit_allowed": false,
      "metadata_commit_allowed": true,
      "active_language_overlap_status": "not_applicable_identifier_mapping",
      "update_cadence": "provider_date_snapshots",
      "expected_reviewer_burden": "high",
      "status": "metadata_verified_payload_blocked",
      "retrieved_at": "2026-08-01T00:00:00Z",
      "evidence_urls": [
        "https://github.com/obophenotype/human-phenotype-ontology/blob/v2026-06-23/docs/developers/mappings.md",
        "https://data.monarchinitiative.org/mappings/2026-07-19/umls_hp.sssom.tsv"
      ],
      "members": []
    },
    {
      "source_id": "hpo-hp-upheno-sssom",
      "mapping_family": "HP-UPHENO",
      "provider": "Monarch Initiative",
      "originating_authority": "uPheno pipeline",
      "authority_role": "generated_pipeline",
      "format": "SSSOM TSV",
      "source_release": "2026-07-19",
      "release_kind": "date_snapshot",
      "versioned_url": "https://data.monarchinitiative.org/mappings/2026-07-19/upheno-species-independent.sssom.tsv",
      "mutable_alias_url": "https://data.monarchinitiative.org/mappings/latest/upheno-species-independent.sssom.tsv",
      "integrity": {"algorithm": "sha256", "value": "d71d115241eaaa6fb362bcd4debe72126ebb7179d9efca73eb71f609dbeaefb8"},
      "artifact_size_bytes": 6980013,
      "mapping_set_id": "https://w3id.org/sssom/mappings/953bc698-d97d-4ef9-ba2e-1e3ce6b738ad",
      "semantic_role": "compositional",
      "origin_dataset": "uPheno species-independent build pipeline",
      "derivation_path": ["uPheno constituent phenotype ontologies", "uPheno build pipeline", "species-independent SSSOM snapshot"],
      "shared_lineage_cluster": "upheno-generated-species-independent",
      "independent_evidence_group": "upheno-pipeline-2026-07-19",
      "license_status": "sssom_license_unspecified_maintainer_review_required",
      "license_evidence_url": "https://data.monarchinitiative.org/mappings/2026-07-19/upheno-species-independent.sssom.tsv",
      "payload_commit_allowed": false,
      "metadata_commit_allowed": true,
      "active_language_overlap_status": "not_applicable_identifier_mapping",
      "update_cadence": "provider_date_snapshots",
      "expected_reviewer_burden": "high",
      "status": "metadata_verified_payload_blocked",
      "retrieved_at": "2026-08-01T00:00:00Z",
      "evidence_urls": [
        "https://github.com/obophenotype/human-phenotype-ontology/blob/v2026-06-23/docs/developers/mappings.md",
        "https://data.monarchinitiative.org/mappings/2026-07-19/upheno-species-independent.sssom.tsv"
      ],
      "members": []
    },
    {
      "source_id": "hpo-hp-mp-manual-collection",
      "mapping_family": "HP-MP manually curated collection",
      "provider": "Mouse-Human Mapping Initiative collaborators",
      "originating_authority": "Monarch Initiative, MGI, IMPC, Pistoia Alliance, and contributing curators",
      "authority_role": "curated_collaboration",
      "format": "SSSOM TSV collection",
      "source_release": "1ed989cc6d367890f16ce6ee43d4d257d6615137",
      "release_kind": "git_commit",
      "versioned_url": "https://github.com/mapping-commons/mh_mapping_initiative/tree/1ed989cc6d367890f16ce6ee43d4d257d6615137/mappings",
      "mutable_alias_url": "https://github.com/mapping-commons/mh_mapping_initiative/tree/master/mappings",
      "integrity": {"algorithm": "git_commit", "value": "1ed989cc6d367890f16ce6ee43d4d257d6615137"},
      "artifact_size_bytes": 496340,
      "mapping_set_id": "https://w3id.org/sssom/commons/mouse-human",
      "semantic_role": "crosswalk",
      "origin_dataset": "Mouse-Human Mapping Initiative curated collection",
      "derivation_path": ["contributor mapping sets", "Mouse-Human Mapping Initiative registry", "pinned repository commit"],
      "shared_lineage_cluster": "mouse-human-mapping-initiative",
      "independent_evidence_group": "mhmi-curation-collection-1ed989c",
      "license_status": "per_file_license_declared_repository_review_required",
      "license_evidence_url": "https://github.com/mapping-commons/mh_mapping_initiative/tree/1ed989cc6d367890f16ce6ee43d4d257d6615137/mappings",
      "payload_commit_allowed": false,
      "metadata_commit_allowed": true,
      "active_language_overlap_status": "not_applicable_identifier_mapping",
      "update_cadence": "irregular_repository_commits",
      "expected_reviewer_burden": "high",
      "status": "metadata_verified_payload_blocked",
      "retrieved_at": "2026-08-01T00:00:00Z",
      "evidence_urls": [
        "https://github.com/obophenotype/human-phenotype-ontology/blob/v2026-06-23/docs/developers/mappings.md",
        "https://github.com/mapping-commons/mh_mapping_initiative/commit/1ed989cc6d367890f16ce6ee43d4d257d6615137",
        "https://github.com/mapping-commons/mh_mapping_initiative/blob/1ed989cc6d367890f16ce6ee43d4d257d6615137/registry.yml"
      ],
      "members": [
        {"name": "mp_hp_eye_impc.sssom.tsv", "size_bytes": 6280, "sha256": "b3bd039ad77952ca346327cc174002faab4f7028bb7e5fa8c67fdf7fa8444f2e", "declared_license": "CC0-1.0", "url": "https://raw.githubusercontent.com/mapping-commons/mh_mapping_initiative/1ed989cc6d367890f16ce6ee43d4d257d6615137/mappings/mp_hp_eye_impc.sssom.tsv"},
        {"name": "mp_hp_hwt_impc.sssom.tsv", "size_bytes": 1475, "sha256": "5a16cdab600f6168fa8381404a47d3528c14f21b2cca0f49665f60c3e33901b8", "declared_license": "CC0-1.0", "url": "https://raw.githubusercontent.com/mapping-commons/mh_mapping_initiative/1ed989cc6d367890f16ce6ee43d4d257d6615137/mappings/mp_hp_hwt_impc.sssom.tsv"},